# Dismissed Cases Re-evaluation Report

**Generated:** 2025-12-20 16:47:07

## Summary

| Metric | Count |
|--------|-------|
| Cases checked | 3313 |
| Still skipped (no indicators) | 3240 |
| Candidates found | 73 |
| Successfully promoted | 72 |
| Errors | 0 |

## Promoted Cases

The following cases were promoted from `skipped_cases` to the main `cases` table:

| Case Number | County | File Date | Classification | Sale Date | Key Event |
|-------------|--------|-----------|----------------|-----------|----------|
| 25SP000178-520 | Lee | 2025-12-05 | upcoming | N/A |  |
| 25SP000170-520 | Lee | 2025-11-19 | upcoming | N/A |  |
| 25SP001086-310 | Durham | 2025-11-14 | upcoming | N/A |  |
| 25SP001023-310 | Durham | 2025-10-29 | upcoming | N/A |  |
| 25SP002447-910 | Wake | 2025-10-27 | upcoming | N/A |  |
| 25SP002409-910 | Wake | 2025-10-22 | upcoming | N/A |  |
| 25SP000383-670 | Orange | 2025-10-10 | upcoming | N/A |  |
| 25SP000363-670 | Orange | 2025-09-30 | upcoming | N/A |  |
| 25SP000132-520 | Lee | 2025-09-12 | upcoming | N/A |  |
| 25SP001804-910 | Wake | 2025-08-13 | upset_bid | 2025-12-18 | Report of Sale |
| 25SP000124-180 | Chatham | 2025-07-29 | upcoming | N/A |  |
| 25SP000701-310 | Durham | 2025-07-18 | upcoming | N/A |  |
| 25SP000553-310 | Durham | 2025-05-29 | upcoming | N/A |  |
| 25SP000045-180 | Chatham | 2025-03-19 | upcoming | N/A |  |
| 25SP000094-420 | Harnett | 2025-03-05 | upcoming | N/A |  |
| 25SP000034-180 | Chatham | 2025-02-18 | upcoming | N/A |  |
| 25SP000152-310 | Durham | 2025-02-12 | upcoming | N/A | Partition Proceedings Summons |
| 25SP000010-180 | Chatham | 2025-01-15 | upcoming | N/A |  |
| 24SP001167-180 | Chatham | 2024-12-06 | upcoming | N/A |  |
| 24SP001446-310 | Durham | 2024-05-23 | upcoming | N/A |  |
| 24SP000350-310 | Durham | 2024-04-23 | upcoming | N/A |  |
| 23SP001097-310 | Durham | 2023-12-21 | upcoming | N/A |  |
| 23SP000970-310 | Durham | 2023-11-09 | upcoming | N/A |  |
| 23SP000945-310 | Durham | 2023-10-31 | upcoming | N/A |  |
| 23SP000218-670 | Orange | 2023-08-21 | upcoming | N/A |  |
| 23SP002788-910 | Wake | 2023-08-16 | upcoming | N/A |  |
| 23SP000203-670 | Orange | 2023-08-08 | upcoming | N/A |  |
| 23SP000618-310 | Durham | 2023-07-14 | upcoming | N/A |  |
| 23SP000571-310 | Durham | 2023-06-26 | upcoming | N/A |  |
| 23SP000132-670 | Orange | 2023-05-09 | upcoming | N/A | Order for Sale in Lieu of Actual Partiti |
| 23SP000366-310 | Durham | 2023-04-19 | upcoming | N/A |  |
| 23SP000256-310 | Durham | 2023-03-15 | upcoming | N/A |  |
| 23SP001435-910 | Wake | 2023-02-27 | upcoming | N/A |  |
| 23SP001434-910 | Wake | 2023-02-27 | upcoming | N/A |  |
| 23SP000128-910 | Wake | 2023-01-19 | upcoming | N/A |  |
| 22SP000418-420 | Harnett | 2022-12-07 | upcoming | N/A |  |
| 22SP000164-520 | Lee | 2022-12-07 | upcoming | N/A | Partition |
| 22SP002196-910 | Wake | 2022-11-09 | upcoming | N/A |  |
| 22SP002064-910 | Wake | 2022-10-25 | upcoming | N/A |  |
| 22SP000362-420 | Harnett | 2022-10-19 | upcoming | N/A |  |
| 22SP001933-910 | Wake | 2022-10-06 | upcoming | N/A |  |
| 22SP001461-910 | Wake | 2022-08-02 | upcoming | N/A |  |
| 22SP000281-420 | Harnett | 2022-07-29 | upcoming | N/A |  |
| 22SP001281-910 | Wake | 2022-07-05 | upcoming | N/A |  |
| 22SP001151-910 | Wake | 2022-06-15 | upcoming | N/A |  |
| 22SP000318-310 | Durham | 2022-04-26 | upcoming | N/A |  |
| 22SP000084-670 | Orange | 2022-04-13 | upcoming | N/A |  |
| 22SP000654-910 | Wake | 2022-04-08 | upcoming | N/A |  |
| 22SP000565-910 | Wake | 2022-03-30 | upcoming | N/A |  |
| 22SP000172-910 | Wake | 2022-02-03 | upcoming | N/A | Partition Proceedings Summons |
| 21SP000256-420 | Harnett | 2021-12-28 | upcoming | N/A |  |
| 21SP000723-310 | Durham | 2021-11-01 | upcoming | N/A |  |
| 21SP000631-310 | Durham | 2021-10-04 | upcoming | N/A | ORDER FOR SALE |
| 21SP001571-910 | Wake | 2021-09-23 | upcoming | N/A |  |
| 21SP001516-910 | Wake | 2021-09-15 | upcoming | N/A |  |
| 21SP000159-420 | Harnett | 2021-09-10 | upcoming | N/A |  |
| 21SP000536-310 | Durham | 2021-09-01 | upcoming | N/A |  |
| 21SP001301-910 | Wake | 2021-08-13 | upcoming | N/A |  |
| 21SP001203-910 | Wake | 2021-08-03 | upcoming | N/A |  |
| 21SP000126-670 | Orange | 2021-06-28 | upcoming | N/A |  |
| 21SP000373-310 | Durham | 2021-06-24 | upcoming | N/A |  |
| 21SP000358-310 | Durham | 2021-06-21 | upcoming | N/A |  |
| 21SP000177-310 | Durham | 2021-03-24 | upcoming | N/A |  |
| 21SP000016-670 | Orange | 2021-02-01 | upcoming | N/A |  |
| 20SP000668-310 | Durham | 2020-12-04 | upcoming | N/A |  |
| 20SP000222-420 | Harnett | 2020-10-02 | upcoming | N/A |  |
| 20SP000134-670 | Orange | 2020-08-25 | upcoming | N/A |  |
| 20SP000399-310 | Durham | 2020-07-14 | upcoming | N/A |  |
| 20SP001189-910 | Wake | 2020-07-13 | upcoming | N/A |  |
| 20SP000114-420 | Harnett | 2020-04-28 | upcoming | N/A |  |
| 20SP000168-310 | Durham | 2020-03-02 | upcoming | N/A | ORDER FOR SALE OF PROPERTY |
| 20SP000034-670 | Orange | 2020-01-30 | upcoming | N/A |  |
| 20SP000179-910 | Wake | 2020-01-24 | upcoming | N/A |  |

### Case Details

#### 25SP000178-520

- **County:** Lee
- **File Date:** 2025-12-05
- **Case Type:** Special Proceeding
- **Sale Date:** None
- **Events:** 164

**Key Events:**
- 12/05/2025: Cause of Action
- 12/15/2025: Certificate of Service
- None: Guardian ad Litem
- 12/15/2025: Certificate of Service
- None: Attorney
- None: Petitioner
- None: Respondent
- 12/11/2025: Certificate of Service
- None: Attorney
- None: Petitioner

---

#### 25SP000170-520

- **County:** Lee
- **File Date:** 2025-11-19
- **Case Type:** Special Proceeding
- **Sale Date:** None
- **Events:** 15

**Key Events:**
- 11/19/2025: Cause of Action
- 11/19/2025: Cause of Action
- 11/20/2025: Other/Miscellaneous
- None: Guardian ad Litem
- 11/19/2025: Special Proceedings Summons
- None: Petitioner
- None: Unnamed Defendant
- 11/19/2025: Cover Sheet
- 11/19/2025: Petitioner
- None: Petitioner

---

#### 25SP001086-310

- **County:** Durham
- **File Date:** 2025-11-14
- **Case Type:** Special Proceeding
- **Sale Date:** None
- **Events:** 9

**Key Events:**
- 12/17/2025: Order to sell
- 12/17/2025: Electronic Service by Clerk
- 12/17/2025: Electronic Service by Clerk
- 11/14/2025: Petition to Sell/Lease/Mortgage Ward's Estate
- 11/14/2025: Other Pleading Type
- 11/14/2025: Other Pleading Type
- 11/14/2025: Cover Sheet
- 11/14/2025: Petition

---

#### 25SP001023-310

- **County:** Durham
- **File Date:** 2025-10-29
- **Case Type:** Special Proceeding
- **Sale Date:** None
- **Events:** 7

**Key Events:**
- 11/24/2025: Notice Of Hearing on Motions
- 10/29/2025: Cover Sheet
- 10/29/2025: Petition to Sell/Lease/Mortgage Ward's Estate
- 10/29/2025: Special Proceedings Summons
- 10/29/2025: Petition
- 10/29/2025: Special Proceedings Summons
- None: Issued

---

#### 25SP002447-910

- **County:** Wake
- **File Date:** 2025-10-27
- **Case Type:** Special Proceeding
- **Sale Date:** None
- **Events:** 17

**Key Events:**
- 12/10/2025: Answer
- None: Respondent
- 12/03/2025: Notice of Appearance
- 12/03/2025: Motion to Extend Time
- 12/03/2025: Amended Notice
- 12/03/2025: Affidavit of Service
- 11/20/2025: Notice Of Hearing on Motions
- 11/14/2025: Affidavit of Service
- 10/28/2025: Amended Pleading
- 10/27/2025: Petition

---

#### 25SP002409-910

- **County:** Wake
- **File Date:** 2025-10-22
- **Case Type:** Special Proceeding
- **Sale Date:** None
- **Events:** 7

**Key Events:**
- 12/09/2025: Writ Of Possession
- 10/23/2025: Consent Order
- 10/22/2025: Petition
- None: Attorney
- None: Petitioner
- None: Respondent
- 10/22/2025: Petition

---

#### 25SP000383-670

- **County:** Orange
- **File Date:** 2025-10-10
- **Case Type:** Special Proceeding
- **Sale Date:** None
- **Events:** 33

**Key Events:**
- 11/18/2025: Affidavit of Service
- 11/18/2025: Notice (General)
- 11/05/2025: Answer
- 10/27/2025: Certificate of Service
- 10/27/2025: Amended Pleading
- 10/27/2025: Special Proceedings Summons
- 10/27/2025: Special Proceedings Summons
- 10/27/2025: Special Proceedings Summons
- 10/27/2025: Special Proceedings Summons
- 10/27/2025: Special Proceedings Summons

---

#### 25SP000363-670

- **County:** Orange
- **File Date:** 2025-09-30
- **Case Type:** Special Proceeding
- **Sale Date:** None
- **Events:** 8

**Key Events:**
- 10/24/2025: Order to Disburse Funds
- 10/08/2025: Notice (General)
- 09/30/2025: Petition to Recover Disputed Monies
- 09/30/2025: Other/Miscellaneous
- 09/30/2025: Petition
- 10/24/2025: Hearing Before the Clerk
- 10/24/2025: MINUTES -

---

#### 25SP000132-520

- **County:** Lee
- **File Date:** 2025-09-12
- **Case Type:** Special Proceeding
- **Sale Date:** None
- **Events:** 22

**Key Events:**
- 09/25/2025: Answer
- None: Respondent
- None: Attorney
- 09/25/2025: Cover Sheet
- 09/12/2025: Special Proceedings Summons
- None: Petitioner
- None: Respondent
- None: Respondent
- 09/12/2025: Cover Sheet
- 09/12/2025: Special Proceedings Summons

---

#### 25SP001804-910

- **County:** Wake
- **File Date:** 2025-08-13
- **Case Type:** Special Proceeding
- **Sale Date:** 2025-12-18
- **Events:** 13

**Key Events:**
- 12/18/2025: Report of Sale
- 11/24/2025: Return of Service - Served
- None: Respondent
- 09/19/2025: Order for Sale of Ward's Real Property
- 08/21/2025: Amended Notice
- 08/21/2025: Notice Of Hearing on Motions
- 08/13/2025: Petitioner
- None: Petitioner
- None: Guardian of the Person
- None: Respondent

---

#### 25SP000124-180

- **County:** Chatham
- **File Date:** 2025-07-29
- **Case Type:** Special Proceeding
- **Sale Date:** None
- **Events:** 26

**Key Events:**
- 09/24/2025: Petitioner
- None: Petitioner
- None: Respondent
- 09/05/2025: Notice Of Hearing
- None: Respondent
- 09/05/2025: Certificate of Service
- None: Petitioner
- None: Respondent
- 09/04/2025: Servicemember Civil Relief Act
- None: Petitioner

---

#### 25SP000701-310

- **County:** Durham
- **File Date:** 2025-07-18
- **Case Type:** Special Proceeding
- **Sale Date:** None
- **Events:** 10

**Key Events:**
- 08/11/2025: Electronic Service by Clerk
- 08/11/2025: Attorney
- None: Attorney
- 08/05/2025: Other/Miscellaneous
- 07/18/2025: Electronic Service by Clerk
- 07/18/2025: Petition for Control of Decedent's Property
- 07/18/2025: Special Proceedings Summons
- 07/18/2025: Special Proceedings Summons
- 07/18/2025: Notice Of Hearing on Motions
- 07/18/2025: Petition

---

#### 25SP000553-310

- **County:** Durham
- **File Date:** 2025-05-29
- **Case Type:** Special Proceeding
- **Sale Date:** None
- **Events:** 17

**Key Events:**
- 07/01/2025: For Possession and Sale
- None: Attorney
- 07/01/2025: Electronic Service by Clerk
- 06/26/2025: Miscellaneous
- 06/24/2025: Special Proceedings Summons
- 06/04/2025: Miscellaneous
- 06/03/2025: Miscellaneous
- 05/29/2025: Motion to Appoint Guardian ad Litem (GAL)
- 05/29/2025: Special Proceedings Summons

---

#### 25SP000045-180

- **County:** Chatham
- **File Date:** 2025-03-19
- **Case Type:** Special Proceeding
- **Sale Date:** None
- **Events:** 28

**Key Events:**
- 05/23/2025: Attorney
- None: Attorney
- None: Petitioner
- None: Respondent
- 04/29/2025: Second Amended Notice of Hearing
- None: Petitioner
- None: Respondent
- 04/29/2025: Amended Notice of Hearing
- None: Petitioner
- None: Respondent

---

#### 25SP000094-420

- **County:** Harnett
- **File Date:** 2025-03-05
- **Case Type:** Special Proceeding
- **Sale Date:** None
- **Events:** 62

**Key Events:**
- 11/14/2025: Attorney Fees
- 11/04/2025: Petition
- 10/14/2025: Certificate of Service
- 10/13/2025: Order - Sale Or Destruct Of Prop
- 07/31/2025: Certificate of Service
- 07/31/2025: Notice Of Hearing on Motions
- None: Guardian ad Litem
- None: Respondent
- None: Respondent
- None: Respondent

---

#### 25SP000034-180

- **County:** Chatham
- **File Date:** 2025-02-18
- **Case Type:** Special Proceeding
- **Sale Date:** None
- **Events:** 23

**Key Events:**
- 11/25/2025: Notice (General)
- 04/17/2025: Petitioner
- None: Petitioner
- None: Respondent
- 04/09/2025: Answer
- 03/25/2025: Notice Of Hearing on Motions
- None: Respondent
- 03/12/2025: Affidavit of Service
- None: Petitioner
- None: Respondent

---

#### 25SP000152-310

- **County:** Durham
- **File Date:** 2025-02-12
- **Case Type:** Special Proceeding
- **Sale Date:** None
- **Events:** 16

**Key Events:**
- 08/29/2025: Other/Miscellaneous
- 06/05/2025: Answer
- 06/02/2025: Affidavit of Service
- 05/15/2025: Electronic Service by Clerk
- 05/15/2025: Special Proceedings Summons
- 04/08/2025: Alias and Pluries Summons - Returned Unserved
- None: Petitioner
- None: Respondent
- 02/12/2025: Petition
- 02/12/2025: Partition Proceedings Summons

---

#### 25SP000010-180

- **County:** Chatham
- **File Date:** 2025-01-15
- **Case Type:** Special Proceeding
- **Sale Date:** None
- **Events:** 24

**Key Events:**
- 09/24/2025: Attorney
- None: Attorney
- None: Petitioner
- None: Respondent
- 08/15/2025: Notice Of Hearing on Motions
- None: Respondent
- 04/15/2025: Miscellaneous
- 03/06/2025: Alias and Pluries Summons - Issued
- None: Petitioner
- None: Respondent

---

#### 24SP001167-180

- **County:** Chatham
- **File Date:** 2024-12-06
- **Case Type:** Special Proceeding
- **Sale Date:** None
- **Events:** 114

**Key Events:**
- 05/13/2025: Alias and Pluries Summons - Issued
- None: Petitioner
- None: Respondent
- None: Respondent
- 05/13/2025: Alias and Pluries Summons - Issued
- None: Petitioner
- None: Respondent
- None: Respondent
- 05/13/2025: Alias and Pluries Summons - Issued
- None: Petitioner

---

#### 24SP001446-310

- **County:** Durham
- **File Date:** 2024-05-23
- **Case Type:** Special Proceeding
- **Sale Date:** None
- **Events:** 2

**Key Events:**
- 05/23/2024: Petition to Sell/Lease/Mortgage Ward's Estate
- 05/23/2024: Petition

---

#### 24SP000350-310

- **County:** Durham
- **File Date:** 2024-04-23
- **Case Type:** Special Proceeding
- **Sale Date:** None
- **Events:** 11

**Key Events:**
- 04/23/2024: Cause of Action
- 09/19/2025: Notice Of Hearing on Motions
- 08/04/2025: Electronic Service by Clerk
- 08/04/2025: Affidavit of Service
- 08/04/2025: Motion to Withdraw as Counsel
- 08/04/2025: Order for Withdrawal
- None: Petitioner
- None: Petitioner
- 04/24/2024: Legacy Complete Case Scan
- 04/23/2024: Petition

---

#### 23SP001097-310

- **County:** Durham
- **File Date:** 2023-12-21
- **Case Type:** Special Proceeding
- **Sale Date:** None
- **Events:** 4

**Key Events:**
- 12/21/2023: Cause of Action
- 04/13/2024: Legacy Complete Case Scan
- 12/21/2023: FILING
- None: Action - 2023-12-21

---

#### 23SP000970-310

- **County:** Durham
- **File Date:** 2023-11-09
- **Case Type:** Special Proceeding
- **Sale Date:** None
- **Events:** 18

**Key Events:**
- 11/09/2023: Cause of Action
- 11/28/2023: Cause of Action
- 12/28/2023: Cause of Action
- 01/29/2025: Legacy Complete Case Scan
- 12/28/2023: FILING
- None: ORDER CONFIRMIMG SALE
- 11/29/2023: FILING
- 11/28/2023: FILING
- None: ORDER OF SALE
- 11/09/2023: Petition

---

#### 23SP000945-310

- **County:** Durham
- **File Date:** 2023-10-31
- **Case Type:** Special Proceeding
- **Sale Date:** None
- **Events:** 6

**Key Events:**
- 10/31/2023: Cause of Action
- None: AQUA NORTH CAROLINA INC
- None: OLD NORTH STATE CORPORATION
- 04/13/2024: Legacy Complete Case Scan
- 10/31/2023: Petition
- None: Action - 2023-10-31

---

#### 23SP000218-670

- **County:** Orange
- **File Date:** 2023-08-21
- **Case Type:** Special Proceeding
- **Sale Date:** None
- **Events:** 13

**Key Events:**
- 08/21/2023: Cause of Action
- 08/29/2023: Cause of Action
- 04/24/2024: Legacy Complete Case Scan
- 02/21/2024: FILING
- 02/21/2024: Confirmation
- None: Petitioner
- None: Respondent
- 08/29/2023: FILING
- None: ORDER TO SELL PROPERTY
- 08/21/2023: FILING

---

#### 23SP002788-910

- **County:** Wake
- **File Date:** 2023-08-16
- **Case Type:** Special Proceeding
- **Sale Date:** None
- **Events:** 12

**Key Events:**
- 03/15/2024: Notice Of Hearing on Motions
- 08/25/2023: Return of Service - Served
- None: Respondent
- 08/16/2023: Petition
- None: Administrator
- None: Attorney
- None: Petitioner
- None: Respondent
- 08/16/2023: Civil Summons
- None: Respondent

---

#### 23SP000203-670

- **County:** Orange
- **File Date:** 2023-08-08
- **Case Type:** Special Proceeding
- **Sale Date:** None
- **Events:** 8

**Key Events:**
- 08/08/2023: Cause of Action
- 04/24/2024: Legacy Complete Case Scan
- 08/22/2023: FILING
- 08/22/2023: Confirmation
- None: Petitioner
- None: Respondent
- 08/08/2023: Petition
- None: Action - 2023-08-08

---

#### 23SP000618-310

- **County:** Durham
- **File Date:** 2023-07-14
- **Case Type:** Special Proceeding
- **Sale Date:** None
- **Events:** 18

**Key Events:**
- 07/14/2023: Cause of Action
- 10/27/2023: Cause of Action
- 04/15/2024: Legacy Complete Case Scan
- 10/27/2023: FILING
- None: MOTION/ORDER EXTENDING TIME
- 07/14/2023: Petition
- None: Action - 2023-07-14
- 07/14/2023: Reg Summons
- None: Respondent
- None: Action - 2023-07-14

---

#### 23SP000571-310

- **County:** Durham
- **File Date:** 2023-06-26
- **Case Type:** Special Proceeding
- **Sale Date:** None
- **Events:** 23

**Key Events:**
- 01/17/2024: Cause of Action
- 11/15/2023: Cause of Action
- 06/26/2023: Cause of Action
- 09/20/2023: Cause of Action
- 12/02/2025: Alias and Pluries Summons - Served
- 10/13/2025: Special Proceedings Summons
- 04/13/2024: Legacy Complete Case Scan
- 01/17/2024: FILING
- None: CONSENT ORDER OF SALE
- 11/15/2023: FILING

---

#### 23SP000132-670

- **County:** Orange
- **File Date:** 2023-05-09
- **Case Type:** Special Proceeding
- **Sale Date:** None
- **Events:** 36

**Key Events:**
- 05/09/2023: Cause of Action
- 12/18/2023: Cause of Action
- 12/11/2023: Cause of Action
- 06/19/2024: Electronic Service by Clerk
- 06/19/2024: Amended Order Directing Distribution of Sale Proceeds
- 06/17/2024: Directing Distribution of Sale Proceeds
- 05/16/2024: Motion
- 05/08/2024: Final Account Or Final Report
- None: Petitioner

---

#### 23SP000366-310

- **County:** Durham
- **File Date:** 2023-04-19
- **Case Type:** Special Proceeding
- **Sale Date:** None
- **Events:** 4

**Key Events:**
- 04/19/2023: Cause of Action
- 04/13/2024: Legacy Complete Case Scan
- 04/19/2023: Petition
- None: Action - 2023-04-19

---

#### 23SP000256-310

- **County:** Durham
- **File Date:** 2023-03-15
- **Case Type:** Special Proceeding
- **Sale Date:** None
- **Events:** 4

**Key Events:**
- 03/15/2023: Cause of Action
- 04/13/2024: Legacy Complete Case Scan
- 03/15/2023: Petition
- None: Action - 2023-03-15

---

#### 23SP001435-910

- **County:** Wake
- **File Date:** 2023-02-27
- **Case Type:** Special Proceeding
- **Sale Date:** None
- **Events:** 3

**Key Events:**
- 03/09/2023: Appointing GAL
- 02/27/2023: Petition to Sell/Lease/Mortgage Ward's Estate
- 02/27/2023: Petition

---

#### 23SP001434-910

- **County:** Wake
- **File Date:** 2023-02-27
- **Case Type:** Special Proceeding
- **Sale Date:** None
- **Events:** 3

**Key Events:**
- 03/09/2023: Motion
- 02/27/2023: Petition to Sell/Lease/Mortgage Ward's Estate
- 02/27/2023: Petition

---

#### 23SP000128-910

- **County:** Wake
- **File Date:** 2023-01-19
- **Case Type:** Special Proceeding
- **Sale Date:** None
- **Events:** 40

**Key Events:**
- 01/19/2023: Cause of Action
- 02/01/2023: Cause of Action
- 03/06/2023: Amended Order Confirming Sale
- 03/01/2023: Amended Proposed Order Confirming Sale
- 02/28/2023: Other/Miscellaneous
- 02/27/2023: Confirming Private Sale
- 02/03/2023: FILING
- 02/03/2023: Authorization To Sell
- None: Decedent
- None: Decedent

---

#### 22SP000418-420

- **County:** Harnett
- **File Date:** 2022-12-07
- **Case Type:** Special Proceeding
- **Sale Date:** None
- **Events:** 22

**Key Events:**
- 12/07/2022: Cause of Action
- 03/29/2023: Case Closed
- 03/07/2023: Other/Miscellaneous
- 03/07/2023: Attorney Fees
- None: Attorney
- None: Petitioner
- None: Petitioner
- None: Respondent
- 03/07/2023: Order to Disburse Funds
- None: Petitioner

---

#### 22SP000164-520

- **County:** Lee
- **File Date:** 2022-12-07
- **Case Type:** Special Proceeding
- **Sale Date:** None
- **Events:** 81

**Key Events:**
- 12/07/2022: Cause of Action
- 11/20/2025: Petitioner
- None: Petitioner
- None: Respondent
- 05/02/2025: Other/Miscellaneous
- 04/08/2025: Other/Miscellaneous
- None: Commissioner
- None: Commissioner
- None: Commissioner
- None: Petitioner

---

#### 22SP002196-910

- **County:** Wake
- **File Date:** 2022-11-09
- **Case Type:** Special Proceeding
- **Sale Date:** None
- **Events:** 13

**Key Events:**
- 11/09/2022: Cause of Action
- 03/13/2023: Withdrawn
- 11/09/2022: Petition
- None: Action - 2022-11-09
- 11/09/2022: Reg Summons
- None: Respondent
- None: Action - 2022-11-09
- 11/09/2022: Reg Summons
- None: Respondent
- None: Action - 2022-11-09

---

#### 22SP002064-910

- **County:** Wake
- **File Date:** 2022-10-25
- **Case Type:** Special Proceeding
- **Sale Date:** None
- **Events:** 25

**Key Events:**
- 10/25/2022: Cause of Action
- 03/31/2023: Final Account Or Final Report
- 02/23/2023: Confirmation
- 01/26/2023: FILING
- 01/26/2023: FILING
- 01/06/2023: FILING
- 01/06/2023: Authorization To Sell
- None: Administrator
- None: Decedent
- None: Guardian ad Litem

---

#### 22SP000362-420

- **County:** Harnett
- **File Date:** 2022-10-19
- **Case Type:** Special Proceeding
- **Sale Date:** None
- **Events:** 15

**Key Events:**
- 12/19/2022: Cause of Action
- 10/19/2022: Cause of Action
- 04/10/2023: Legacy Complete Case Scan
- 02/23/2023: Review
- 12/19/2022: FILING
- None: ORDER TO SELL REAL PROP PRIVATE SALE
- 10/19/2022: Petition
- None: Action - 2022-10-19
- 12/19/2022: Granted in Whole or Part
- None: ORDER TO SELL REAL PROP PRIVATE SALE

---

#### 22SP001933-910

- **County:** Wake
- **File Date:** 2022-10-06
- **Case Type:** Special Proceeding
- **Sale Date:** None
- **Events:** 20

**Key Events:**
- 10/06/2022: Cause of Action
- 12/21/2022: FILING
- 12/21/2022: Confirmation
- None: Administrator
- None: Decedent
- None: Guardian of the Estate
- None: Respondent
- None: Respondent
- None: Respondent
- 12/02/2022: FILING

---

#### 22SP001461-910

- **County:** Wake
- **File Date:** 2022-08-02
- **Case Type:** Special Proceeding
- **Sale Date:** None
- **Events:** 13

**Key Events:**
- 08/02/2022: Cause of Action
- 01/19/2023: Motion
- 08/02/2022: Petition
- None: Action - 2022-08-02
- 08/02/2022: Reg Summons
- None: Respondent
- None: Action - 2022-08-02
- 08/02/2022: Reg Summons
- None: Respondent
- None: Action - 2022-08-02

---

#### 22SP000281-420

- **County:** Harnett
- **File Date:** 2022-07-29
- **Case Type:** Special Proceeding
- **Sale Date:** None
- **Events:** 10

**Key Events:**
- 09/09/2022: Cause of Action
- 07/29/2022: Cause of Action
- 02/24/2023: Review
- 09/09/2022: FILING
- None: ORDER TO SALE
- 07/29/2022: Petition
- None: Action - 2022-07-29
- 09/09/2022: Granted in Whole or Part
- None: ORDER TO SALE
- 01/30/2023: Other Hearing

---

#### 22SP001281-910

- **County:** Wake
- **File Date:** 2022-07-05
- **Case Type:** Special Proceeding
- **Sale Date:** None
- **Events:** 17

**Key Events:**
- 07/05/2022: Cause of Action
- 09/26/2022: FILING
- 09/26/2022: Authorization To Sell
- None: Administrator
- None: Decedent
- None: Respondent
- None: Respondent
- None: Respondent
- None: Respondent
- None: Respondent

---

#### 22SP001151-910

- **County:** Wake
- **File Date:** 2022-06-15
- **Case Type:** Special Proceeding
- **Sale Date:** None
- **Events:** 12

**Key Events:**
- 06/15/2022: Cause of Action
- 10/04/2022: FILING
- 10/04/2022: FILING
- 09/06/2022: FILING
- 08/17/2022: FILING
- 08/17/2022: Authorization To Sell
- None: Administrator
- None: Decedent
- None: Respondent
- None: Respondent

---

#### 22SP000318-310

- **County:** Durham
- **File Date:** 2022-04-26
- **Case Type:** Special Proceeding
- **Sale Date:** None
- **Events:** 15

**Key Events:**
- 05/16/2022: Cause of Action
- 05/24/2022: Cause of Action
- 04/26/2022: Cause of Action
- 04/13/2024: Legacy Complete Case Scan
- 05/31/2022: FILING
- 05/24/2022: FILING
- None: ORDER TO SALE
- 05/16/2022: Amended Pleading
- None: Action - 2022-05-16
- 04/26/2022: Petition

---

#### 22SP000084-670

- **County:** Orange
- **File Date:** 2022-04-13
- **Case Type:** Special Proceeding
- **Sale Date:** None
- **Events:** 38

**Key Events:**
- 04/13/2022: Cause of Action
- 08/25/2022: Cause of Action
- 10/24/2022: Cause of Action
- 12/03/2024: Withdraw Counsel
- 11/07/2024: Motion to Withdraw as Counsel
- 06/27/2024: Motion
- 06/20/2024: Legacy Complete Case Scan
- 10/24/2022: Motion
- 10/24/2022: In The Cause
- None: Petitioner

---

#### 22SP000654-910

- **County:** Wake
- **File Date:** 2022-04-08
- **Case Type:** Special Proceeding
- **Sale Date:** None
- **Events:** 38

**Key Events:**
- 04/08/2022: Cause of Action
- 09/01/2022: FILING
- 09/01/2022: Confirmation
- None: Administrator
- None: Decedent
- None: Respondent
- None: Respondent
- None: Respondent
- None: Respondent
- None: Respondent

---

#### 22SP000565-910

- **County:** Wake
- **File Date:** 2022-03-30
- **Case Type:** Special Proceeding
- **Sale Date:** None
- **Events:** 160

**Key Events:**
- 11/04/2022: Cause of Action
- 03/30/2022: Cause of Action
- 06/20/2025: Appointing Successor GAL
- 05/09/2025: Notice Of Hearing on Motions
- 05/09/2025: Motion to Appoint Guardian ad Litem (GAL)
- None: Attorney
- None: Petitioner
- 10/19/2023: Motion
- 05/31/2023: Civil Summons
- 05/31/2023: Civil Summons

---

#### 22SP000172-910

- **County:** Wake
- **File Date:** 2022-02-03
- **Case Type:** Special Proceeding
- **Sale Date:** None
- **Events:** 126

**Key Events:**
- 02/03/2022: Cause of Action
- 01/15/2025: Answer
- None: Guardian ad Litem
- 07/23/2024: Notice (General)
- 05/23/2024: Other Pleading Type
- 05/03/2024: Partition Proceedings Summons
- None: Guardian ad Litem
- 05/02/2024: Certificate of Service
- 04/25/2024: Certificate of Service
- 04/25/2024: Substituting Guardian ad Litem For Unknown and Unlocatable Heirs

---

#### 21SP000256-420

- **County:** Harnett
- **File Date:** 2021-12-28
- **Case Type:** Special Proceeding
- **Sale Date:** None
- **Events:** 10

**Key Events:**
- 12/28/2021: Cause of Action
- 03/30/2023: Legacy Complete Case Scan
- 01/09/2022: Return of Service - Served
- None: Respondent
- 12/28/2021: Petition
- None: Action - 2021-12-28
- 12/28/2021: Reg Summons
- None: Respondent
- None: Action - 2021-12-28
- 06/30/2022: Other Hearing

---

#### 21SP000723-310

- **County:** Durham
- **File Date:** 2021-11-01
- **Case Type:** Special Proceeding
- **Sale Date:** None
- **Events:** 4

**Key Events:**
- 11/01/2021: Cause of Action
- 04/12/2024: Legacy Complete Case Scan
- 11/01/2021: Petition
- None: Action - 2021-11-01

---

#### 21SP000631-310

- **County:** Durham
- **File Date:** 2021-10-04
- **Case Type:** Special Proceeding
- **Sale Date:** None
- **Events:** 10

**Key Events:**
- 10/04/2021: Cause of Action
- 12/01/2021: Cause of Action
- 04/11/2024: Legacy Complete Case Scan
- 12/01/2021: Petition
- None: ORDER FOR SALE
- 10/04/2021: Petition
- None: POSSESSION/CUSTODY/CONTROL
- 12/03/2021: Granted in Whole or Part
- None: ORDER FOR SALE
- 10/04/2021: Other Hearing

---

#### 21SP001571-910

- **County:** Wake
- **File Date:** 2021-09-23
- **Case Type:** Special Proceeding
- **Sale Date:** None
- **Events:** 13

**Key Events:**
- 09/23/2021: Cause of Action
- None: PIEDMONT NATURAL GAS CO INC
- 12/17/2021: FILING
- 10/19/2021: Motion
- 10/19/2021: Appointing Guardian ad Litem (GAL)
- None: Petitioner
- None: Respondent
- None: Respondent
- None: Respondent
- None: Respondent

---

#### 21SP001516-910

- **County:** Wake
- **File Date:** 2021-09-15
- **Case Type:** Special Proceeding
- **Sale Date:** None
- **Events:** 3

**Key Events:**
- 09/15/2021: Cause of Action
- 09/15/2021: Petition
- None: Action - 2021-09-15

---

#### 21SP000159-420

- **County:** Harnett
- **File Date:** 2021-09-10
- **Case Type:** Special Proceeding
- **Sale Date:** None
- **Events:** 32

**Key Events:**
- 11/22/2021: Cause of Action
- 09/10/2021: Cause of Action
- 04/17/2023: Legacy Complete Case Scan
- 02/18/2022: FILING
- 02/18/2022: Confirmation
- None: Petitioner
- None: Petitioner
- None: Respondent
- None: Respondent
- None: Respondent

---

#### 21SP000536-310

- **County:** Durham
- **File Date:** 2021-09-01
- **Case Type:** Special Proceeding
- **Sale Date:** None
- **Events:** 4

**Key Events:**
- 09/01/2021: Cause of Action
- 04/17/2024: Legacy Complete Case Scan
- 09/01/2021: Petition
- None: Action - 2021-09-01

---

#### 21SP001301-910

- **County:** Wake
- **File Date:** 2021-08-13
- **Case Type:** Special Proceeding
- **Sale Date:** None
- **Events:** 17

**Key Events:**
- 08/13/2021: Cause of Action
- 09/24/2025: Legacy Complete Case Scan
- 04/14/2022: FILING
- 04/14/2022: Confirmation
- None: Decedent
- None: Petitioner
- None: Respondent
- None: Respondent
- 03/29/2022: FILING
- 02/16/2022: FILING

---

#### 21SP001203-910

- **County:** Wake
- **File Date:** 2021-08-03
- **Case Type:** Special Proceeding
- **Sale Date:** None
- **Events:** 23

**Key Events:**
- 08/03/2021: Cause of Action
- 08/10/2023: Consent Order
- 06/28/2023: Order to Continue
- 05/16/2023: Notice Of Hearing on Motions
- 05/09/2023: Order for Payment of Commissoner Fees
- 05/08/2023: Final Account Or Final Report
- 05/08/2023: Petition
- 12/05/2022: FILING
- 12/05/2022: Confirmation
- None: Petitioner

---

#### 21SP000126-670

- **County:** Orange
- **File Date:** 2021-06-28
- **Case Type:** Special Proceeding
- **Sale Date:** None
- **Events:** 46

**Key Events:**
- 07/16/2021: Cause of Action
- 06/28/2021: Cause of Action
- 10/28/2022: FILING
- 10/28/2022: Confirmation
- None: Petitioner
- None: Petitioner
- None: Respondent
- None: Respondent
- None: Respondent
- None: Respondent

---

#### 21SP000373-310

- **County:** Durham
- **File Date:** 2021-06-24
- **Case Type:** Special Proceeding
- **Sale Date:** None
- **Events:** 9

**Key Events:**
- 06/24/2021: Cause of Action
- 11/18/2021: Cause of Action
- 04/17/2024: Legacy Complete Case Scan
- 11/18/2021: FILING
- None: PRDER FOR SALE OD REAL PROPERTY
- 06/24/2021: Petition
- None: Action - 2021-06-24
- 11/18/2021: Granted in Whole or Part
- None: PRDER FOR SALE OD REAL PROPERTY

---

#### 21SP000358-310

- **County:** Durham
- **File Date:** 2021-06-21
- **Case Type:** Special Proceeding
- **Sale Date:** None
- **Events:** 9

**Key Events:**
- 06/21/2021: Cause of Action
- 06/22/2021: Cause of Action
- 04/17/2024: Legacy Complete Case Scan
- 06/22/2021: FILING
- None: ORDER TO SALE
- 06/21/2021: Petition
- None: Action - 2021-06-21
- 06/22/2021: Granted in Whole or Part
- None: ORDER TO SALE

---

#### 21SP000177-310

- **County:** Durham
- **File Date:** 2021-03-24
- **Case Type:** Special Proceeding
- **Sale Date:** None
- **Events:** 9

**Key Events:**
- 03/24/2021: Cause of Action
- 03/25/2021: Cause of Action
- 04/10/2024: Legacy Complete Case Scan
- 03/25/2021: FILING
- None: ORDER PERMITTING SALE/REAL PROPERTY
- 03/24/2021: Petition
- None: Action - 2021-03-24
- 03/25/2021: Granted in Whole or Part
- None: ORDER PERMITTING SALE/REAL PROPERTY

---

#### 21SP000016-670

- **County:** Orange
- **File Date:** 2021-02-01
- **Case Type:** Special Proceeding
- **Sale Date:** None
- **Events:** 13

**Key Events:**
- 02/01/2021: Cause of Action
- 02/01/2021: Cause of Action
- 04/21/2021: FILING
- 04/21/2021: Confirmation
- None: Petitioner
- None: Petitioner
- 02/12/2021: FILING
- 02/01/2021: Petition
- None: Action - 2021-02-01
- 02/01/2021: FILING

---

#### 20SP000668-310

- **County:** Durham
- **File Date:** 2020-12-04
- **Case Type:** Special Proceeding
- **Sale Date:** None
- **Events:** 10

**Key Events:**
- 12/04/2020: Cause of Action
- 12/08/2020: Cause of Action
- 04/11/2024: Legacy Complete Case Scan
- 12/08/2020: FILING
- None: ORDER TO SALE
- 12/04/2020: Petition
- None: Action - 2020-12-04
- 12/08/2020: Granted in Whole or Part
- None: ORDER TO SALE
- 12/08/2020: Other Hearing

---

#### 20SP000222-420

- **County:** Harnett
- **File Date:** 2020-10-02
- **Case Type:** Special Proceeding
- **Sale Date:** None
- **Events:** 65

**Key Events:**
- 08/17/2021: Cause of Action
- 10/02/2020: Cause of Action
- 02/02/2024: Notice (General)
- None: Petitioner
- None: Respondent
- None: Respondent
- None: Respondent
- None: Respondent
- None: Respondent
- 12/22/2023: Other/Miscellaneous

---

#### 20SP000134-670

- **County:** Orange
- **File Date:** 2020-08-25
- **Case Type:** Special Proceeding
- **Sale Date:** None
- **Events:** 4

**Key Events:**
- 08/25/2020: Cause of Action
- 08/25/2020: Petition
- None: Action - 2020-08-25
- 08/25/2020: Motion

---

#### 20SP000399-310

- **County:** Durham
- **File Date:** 2020-07-14
- **Case Type:** Special Proceeding
- **Sale Date:** None
- **Events:** 4

**Key Events:**
- 07/14/2020: Cause of Action
- 04/11/2024: Legacy Complete Case Scan
- 07/14/2020: Petition
- None: Action - 2020-07-14

---

#### 20SP001189-910

- **County:** Wake
- **File Date:** 2020-07-13
- **Case Type:** Special Proceeding
- **Sale Date:** None
- **Events:** 17

**Key Events:**
- 07/13/2020: Cause of Action
- 12/03/2020: Cause of Action
- 12/03/2020: FILING
- 12/03/2020: Authorization To Sell
- None: Decedent
- None: Executor
- None: Respondent
- None: Respondent
- None: Respondent
- None: Respondent

---

#### 20SP000114-420

- **County:** Harnett
- **File Date:** 2020-04-28
- **Case Type:** Special Proceeding
- **Sale Date:** None
- **Events:** 25

**Key Events:**
- 04/28/2020: Cause of Action
- 08/04/2020: Cause of Action
- 04/13/2023: Legacy Complete Case Scan
- 03/09/2021: FILING
- 03/09/2021: Confirmation
- None: Petitioner
- None: Petitioner
- None: Respondent
- None: Respondent
- 12/17/2020: FILING

---

#### 20SP000168-310

- **County:** Durham
- **File Date:** 2020-03-02
- **Case Type:** Special Proceeding
- **Sale Date:** None
- **Events:** 9

**Key Events:**
- 03/02/2020: Cause of Action
- 03/03/2020: Cause of Action
- 04/11/2024: Legacy Complete Case Scan
- 03/03/2020: FILING
- None: ORDER FOR SALE OF PROPERTY
- 03/02/2020: Petition
- None: Action - 2020-03-02
- 03/03/2020: Granted in Whole or Part
- None: ORDER FOR SALE OF PROPERTY

---

#### 20SP000034-670

- **County:** Orange
- **File Date:** 2020-01-30
- **Case Type:** Special Proceeding
- **Sale Date:** None
- **Events:** 19

**Key Events:**
- 01/30/2020: Cause of Action
- 02/19/2020: Cause of Action
- 03/03/2020: FILING
- 03/03/2020: Confirmation
- None: Petitioner
- None: Petitioner
- None: Petitioner
- None: Respondent
- None: Respondent
- None: Respondent

---

#### 20SP000179-910

- **County:** Wake
- **File Date:** 2020-01-24
- **Case Type:** Special Proceeding
- **Sale Date:** None
- **Events:** 17

**Key Events:**
- 01/24/2020: Cause of Action
- 02/05/2020: Return of Service - Served
- None: Respondent
- 01/30/2020: Return of Service - Served
- None: Respondent
- 01/24/2020: Alias and Pluries Summons - Issued
- None: Respondent
- None: Action - 2020-01-24
- 01/24/2020: Petition
- None: Action - 2020-01-24

---

## Next Steps

1. Review promoted cases in the dashboard
2. Run OCR/extraction on new cases if needed
3. Monitor for upcoming deadlines
